Timestamp (UTC),Transcription,File,Alexa Response,Profile Name
2023-06-03T20:08:24.536Z,add adidas sports bra to cart,3dad33918bd75e47e95ed00fa73420d25c9def66.wav,Showing items matching adidas sports bra on Amazon.,
2023-06-03T20:09:42.563Z,what are the fashion trends of twenty twenty three,f13e06bf49476dbdb6ef29d439b613c8e8c8cbc4.wav,2023 fashion trends will be shortened trousers and cycling pants.,
2023-06-03T20:11:27.621Z,search for summer outfits,cd75c8c3fc84dbba339c9d9713f935f9307377f5.wav,Showing items matching summer outfits on Amazon.,
2023-06-03T20:10:49.110Z,add meet sun retro designer style sunglasses to cart,8044f7da6d8dfee7e8a112bb6d56c2b506f981b0.wav,Showing items matching meet some retro designer sal sunglasses on Amazon.,
2023-06-03T20:07:42.091Z,search for white halter top,d46ef90bf922155682bfdb78e534aeb054f1969b.wav,Showing items matching white halter top on Amazon.,
2023-06-03T20:08:03.272Z,search for cardigan jackets,2d501ea52c02cef4ac4831e46c4d93308d8e2c99.wav,Showing items matching cardigan jackets on Amazon.,
2023-06-03T20:08:35.110Z,search for red high heels,06c863387fa6d875a69cef772b5f18963a12c800.wav,Showing items matching red high heels on Amazon.,
2023-06-03T20:08:59.935Z,cheap cocktail dresses,da1aa638ccb7e454322aafc1fc78f4dceb982d90.wav,"Sorry, I'm not sure about that.",
2023-06-03T20:11:39.552Z,search for sparkly flip flops,d06544d1d8e0dd8d7b7145f1482fb3946fa62d50.wav,Showing items matching sparkly flip flops on Amazon.,
2023-06-03T20:09:29.423Z,add pearl hair clip to cart,232dc8c09989cc1d36db4a9057634b29f7ada243.wav,Showing items matching pearl hair clip on Amazon.,
2023-06-03T20:08:46.441Z,add red high heels to wish list,08eefbc6cd6f52fe4e8947e082bd316afb531ae4.wav,I couldn't find a list called wish. Should I create one?,
2023-06-03T20:08:46.441Z,add red high heels to wish list,08eefbc6cd6f52fe4e8947e082bd316afb531ae4.wav,I've created wish list and added red high heels to it.,
2023-06-03T20:10:16.676Z, add white blouse to wish list,938fc137f290789df4c3b72349c4369dab73ef76.wav,I've added white blouse to wish.,
2023-06-03T20:10:35.158Z,search for round sunglasses,9ee814c7f5ed843e1fa4e8e5a14e4895967033fb.wav,Showing items matching round sunglasses on Amazon.,
2023-06-03T20:07:30.827Z, search for skirts,0d5fbcb85bec114de3be02cbab50b6083aa32e44.wav,Showing items matching skirts on Amazon.,
2023-06-03T20:09:49.606Z,search for white blouse,c098f3c3e487478d9b61813d4f322b46a14b8aa8.wav,Showing items matching white blouse on Amazon.,
2023-06-03T20:07:51.973Z,search for cheap black skirts,227db1701c49febfa4e230f02769d995f303ffd4.wav,Showing items matching black skirts on Amazon.,
2023-06-03T20:10:23.871Z,search for work tote bag that fits laptop,ffc90b9e2e23991f01e44a9d41683dd05731b8e0.wav,Showing items matching work tote bag that fits laptop on Amazon.,
2023-06-03T20:09:18.581Z,search for black shoulder bag,6f2b4aa947ec79e93ec740585ff2c9a8a53853f1.wav,Showing items matching black shoulder bag on Amazon.,
2023-06-03T20:09:07.863Z,search for small leather purse,a243acd5a71c33f088525a3ea566edd24145202a.wav,Showing items matching small leather purse on Amazon.,
2023-06-03T20:08:14.193Z,add adidas leggings to cart,1d99960272b2f49f650d44b26d1ad95266cd0bee.wav,Showing items matching adidas leggings on Amazon.,